{
  "project": "PANEL-REVIZE",
  "version": "1.0.0",
  "updatedAt": "2026-08-04T08:00:00Z",
  "phases": [
    {
      "phaseId": 0,
      "phaseName": "Hazırlık ve İskelet",
      "criteria": [
        {
          "id": "AC-0.1",
          "description": "panel-v2.html / panel-v2.js / panel-v2.css dosyaları oluşturuldu ve GitHub Pages'te ulaşılabilir.",
          "kind": "functional",
          "status": "passed",
          "verifiedAt": "2026-08-04T00:00:00Z",
          "verifiedBy": "headless-test",
          "evidenceFile": "tests/test_panel_v2_skeleton.js",
          "notes": "DOM id'leri (#app/#root), head içeriği ve temel global App yüzeyi doğrulandı."
        },
        {
          "id": "AC-0.2",
          "description": "PANEL-REVIZE plan dosyaları ve durum şeması repo içinde tutarlı.",
          "kind": "test",
          "status": "passed",
          "verifiedAt": "2026-08-04T00:00:00Z",
          "verifiedBy": "manual-review",
          "evidenceFile": "PANEL-REVIZE-PLANI/panel-revize-state.json",
          "notes": "panel-revize-state.json geçerli JSON ve nextTaskId takibi çalışıyor."
        }
      ]
    },
    {
      "phaseId": 1,
      "phaseName": "Sekme İskeleti ve Top Bar",
      "criteria": [
        {
          "id": "AC-1.1",
          "description": "Bugün, Trendler, Gün Detayı, Arşivler, Sistem sekmeleri render ediliyor ve ARIA role/aria-selected doğru.",
          "kind": "accessibility",
          "status": "passed",
          "verifiedAt": "2026-08-04T01:00:00Z",
          "verifiedBy": "headless-test",
          "evidenceFile": "tests/test_panel_v2_tabs.js",
          "notes": "Tab switching, refresh/logout butonları, title/subtitle güncellenmesi PASS."
        }
      ]
    },
    {
      "phaseId": 2,
      "phaseName": "Genel Bakış",
      "criteria": [
        {
          "id": "AC-2.1",
          "description": "Hero grid (mod, dün uyku, SOS, adım) ve mini trend strip doğru günün verisiyle render ediliyor.",
          "kind": "functional",
          "status": "passed",
          "verifiedAt": "2026-08-04T02:00:00Z",
          "verifiedBy": "headless-test",
          "evidenceFile": "tests/test_panel_v2_today.js",
          "notes": "Bugün/dün ayrımı, boş gün '—' gösterimi, 4 hero kart mevcut."
        }
      ]
    },
    {
      "phaseId": 3,
      "phaseName": "Trendler ve Uyarılar",
      "criteria": [
        {
          "id": "AC-3.1",
          "description": "7/14/30 günlük özet kartları ortalama/delta/boş gün/Streak hesaplamalarını içeriyor.",
          "kind": "functional",
          "status": "passed",
          "verifiedAt": "2026-08-04T03:30:00Z",
          "verifiedBy": "headless-test",
          "evidenceFile": "tests/test_panel_v2_trends.js",
          "notes": "Anomali tespiti (uyku düşüşü, SOS artışı, eksik gün), pencere seçici ve gün detayına atlama PASS."
        }
      ]
    },
    {
      "phaseId": 4,
      "phaseName": "Gün Detayı",
      "criteria": [
        {
          "id": "AC-4.1",
          "description": "Tarih seçici, 30 günlük ısı haritası, redaction kuralları ve alt bölümler (ruh hali, terapi, beslenme, ibadet, hareket, içerik) doğru çalışıyor.",
          "kind": "data-safety",
          "status": "passed",
          "verifiedAt": "2026-08-04T04:30:00Z",
          "verifiedBy": "headless-test",
          "evidenceFile": "tests/test_panel_v2_day_detail.js",
          "notes": "Boş gün, terapi redaction, profile/media/location çıkışı kontrol edildi."
        }
      ]
    },
    {
      "phaseId": 5,
      "phaseName": "Arşivler",
      "criteria": [
        {
          "id": "AC-5.1",
          "description": "Kütüphane, izleme, dinleme ve alıntı listeleri pagination (20 sayfa), arama ve redaction ile render ediliyor.",
          "kind": "functional",
          "status": "passed",
          "verifiedAt": "2026-08-04T05:00:00Z",
          "verifiedBy": "headless-test",
          "evidenceFile": "tests/test_panel_v2_archives.js",
          "notes": "SubTabs, boş durum, daily root merge, 20 sayfalık pagination PASS."
        }
      ]
    },
    {
      "phaseId": 6,
      "phaseName": "Sistem ve Mesajlar",
      "criteria": [
        {
          "id": "AC-6.1",
          "description": "Durum, Audit, Mesajlar, Ayarlar alt-sekmeleri; sync durum detayı, coverage audit, inbox/outbox mesajlaşma ve ayarlar doğru.",
          "kind": "functional",
          "status": "passed",
          "verifiedAt": "2026-08-04T06:00:00Z",
          "verifiedBy": "headless-test",
          "evidenceFile": "tests/test_panel_v2_system.js",
          "notes": "Token/density/theme/oturum ayarları, topbar badge yönlendirme PASS."
        }
      ]
    },
    {
      "phaseId": 7,
      "phaseName": "Premium Polish",
      "criteria": [
        {
          "id": "AC-7.1",
          "description": "Inline stiller kaldırıldı; ARIA etiketleri, reduced-motion, responsive grids, focus/hover polish uygulandı.",
          "kind": "accessibility",
          "status": "passed",
          "verifiedAt": "2026-08-04T07:00:00Z",
          "verifiedBy": "headless-test",
          "evidenceFile": "tests/test_panel_v2_tabs.js",
          "notes": "Tüm Faz 1-6 fixture'ları Faz 7 sonrası yeniden PASS."
        }
      ]
    },
    {
      "phaseId": 8,
      "phaseName": "Test ve Kabul",
      "criteria": [
        {
          "id": "AC-8.1",
          "description": "Tüm Faz 0-7 fixture'ları ortak helper üzerinden yeniden düzenlendi ve PASS.",
          "kind": "test",
          "status": "passed",
          "verifiedAt": "2026-08-04T07:30:00Z",
          "verifiedBy": "headless-test",
          "evidenceFile": "tests/helpers/panel-v2-test-helper.js",
          "notes": "7 fixture: skeleton, tabs, today, trends, day_detail, archives, system."
        },
        {
          "id": "AC-8.2",
          "description": "panel.js ile panel-v2.js KPI hesaplamaları aynı örnek veriyle karşılaştırıldı; farklar belgelendi.",
          "kind": "test",
          "status": "passed",
          "verifiedAt": "2026-08-04T07:45:00Z",
          "verifiedBy": "headless-test",
          "evidenceFile": "tests/test_panel_v2_compare.js",
          "notes": "panel-v2.js metrikleri elle hesaplanan beklentilerle tutarlı; panel.js monolitik olduğu için VM boot edilemedi, karşılaştırma raporu 08-VERI-KARSILASTIRMASI.md'de."
        },
        {
          "id": "AC-8.3",
          "description": "Kabul kriterleri şemaya uygun acceptance JSON olarak kaydedildi ve Faz 0-8 için passed işaretlendi.",
          "kind": "test",
          "status": "passed",
          "verifiedAt": "2026-08-04T08:00:00Z",
          "verifiedBy": "manual-review",
          "evidenceFile": "PANEL-REVIZE-PLANI/panel-revize-acceptance.json",
          "notes": "Şema validasyonu yapıldı; tüm kriterler passed."
        }
      ]
    },
    {
      "phaseId": 9,
      "phaseName": "Geçiş ve Deploy",
      "criteria": [
        {
          "id": "AC-9.1",
          "description": "panel.html/panel.js/panel.css yerine panel-v2.html/panel-v2.js/panel-v2.css kullanıma alınıyor ve eski dosyalar arşivleniyor.",
          "kind": "deploy",
          "status": "not-checked",
          "verifiedAt": null,
          "verifiedBy": null,
          "evidenceFile": null,
          "notes": "Faz 9 başlamadan önce karar verilecek."
        }
      ]
    }
  ]
}
